{
  "seq": 19,
  "ts": "2026-07-07T08:20:11.114Z",
  "type": "tab.input_sent",
  "instance": "com.stage11.c11-12345",
  "v": 1,
  "workspace": "6f9619ff-8b86-d011-b42d-00cf4fc964ff",
  "surface": "c56a4180-65aa-42ec-a945-5fd21dec0538",
  "payload": {
    "caller_tab_id": null,
    "caller_title": null,
    "target_title": "builder",
    "kind": "text",
    "text": "build green",
    "bytes": 11,
    "submitted": true
  }
}
